{
  "schema_version": "0.1",
  "receipt_kind": "garp.compression.disposition",
  "body_kind": "garp.compression.disposition",
  "body": {
    "body_kind": "compression_disposition",
    "candidate_total": 4,
    "retained_claims": [
      { "candidate_ref": "claim_alpha", "source_ref": "src_one" },
      { "candidate_ref": "claim_beta", "source_ref": "src_two" }
    ],
    "refused_candidates": [
      {
        "candidate_ref": "claim_gamma",
        "lifecycle": "rejected",
        "reason": "candidate refused: support_state unsupported; no cited source attaches to the sentence."
      }
    ],
    "omitted_candidates": [],
    "artifact_hashes": {
      "packet.json": "sha256:aaaa",
      "trace.md": "sha256:bbbb"
    }
  }
}
